{
  "format": "tracker-fit-request",
  "version": 1,
  "requestId": "e7c00000-0000-4000-8000-000000000001",
  "snapshotId": "e7c00000-0000-4000-8000-000000000002",
  "source": {
    "application": "Synthetic fixture",
    "version": "mulberry32-boxmuller-1",
    "context": "seed=2027; y=2+10t-4.905t²; sigma=0.02 m; independent Gaussian noise"
  },
  "dataset": {
    "id": "ballistic-demo",
    "label": "Ball toss · synthetic experiment",
    "xColumn": {
      "id": "t",
      "label": "Time",
      "unit": "s"
    },
    "yColumn": {
      "id": "y",
      "label": "Height",
      "unit": "m"
    },
    "assumptions": {
      "exactX": "asserted",
      "gaussianIndependent": "asserted",
      "correctModel": "asserted"
    },
    "rows": [
      {
        "id": "row-0",
        "x": 0,
        "y": 1.9408602137427329,
        "included": true,
        "missingReason": null
      },
      {
        "id": "row-1",
        "x": 0.03333333333333333,
        "y": 2.31662176121672,
        "included": true,
        "missingReason": null
      },
      {
        "id": "row-2",
        "x": 0.06666666666666667,
        "y": 2.627778649940635,
        "included": true,
        "missingReason": null
      },
      {
        "id": "row-3",
        "x": 0.1,
        "y": 2.928436860633279,
        "included": true,
        "missingReason": null
      },
      {
        "id": "row-4",
        "x": 0.13333333333333333,
        "y": 3.223992729657399,
        "included": true,
        "missingReason": null
      },
      {
        "id": "row-5",
        "x": 0.16666666666666666,
        "y": 3.4806225178200165,
        "included": true,
        "missingReason": null
      },
      {
        "id": "row-6",
        "x": 0.2,
        "y": 3.797068017270215,
        "included": true,
        "missingReason": null
      },
      {
        "id": "row-7",
        "x": 0.23333333333333334,
        "y": 4.050746802570037,
        "included": true,
        "missingReason": null
      },
      {
        "id": "row-8",
        "x": 0.26666666666666666,
        "y": 4.2703795636883575,
        "included": true,
        "missingReason": null
      },
      {
        "id": "row-9",
        "x": 0.3,
        "y": 4.559867471304436,
        "included": true,
        "missingReason": null
      },
      {
        "id": "row-10",
        "x": 0.3333333333333333,
        "y": 4.781139945963462,
        "included": true,
        "missingReason": null
      },
      {
        "id": "row-11",
        "x": 0.36666666666666664,
        "y": 4.992675539531019,
        "included": true,
        "missingReason": null
      },
      {
        "id": "row-12",
        "x": 0.4,
        "y": 5.219006396462589,
        "included": true,
        "missingReason": null
      },
      {
        "id": "row-13",
        "x": 0.43333333333333335,
        "y": 5.4252749842111525,
        "included": true,
        "missingReason": null
      },
      {
        "id": "row-14",
        "x": 0.4666666666666667,
        "y": 5.616228455967469,
        "included": true,
        "missingReason": null
      },
      {
        "id": "row-15",
        "x": 0.5,
        "y": 5.745814479793355,
        "included": true,
        "missingReason": null
      },
      {
        "id": "row-16",
        "x": 0.5333333333333333,
        "y": 5.932600768206694,
        "included": true,
        "missingReason": null
      },
      {
        "id": "row-17",
        "x": 0.5666666666666667,
        "y": 6.071013010807742,
        "included": true,
        "missingReason": null
      },
      {
        "id": "row-18",
        "x": 0.6,
        "y": 6.231631143935349,
        "included": true,
        "missingReason": null
      },
      {
        "id": "row-19",
        "x": 0.6333333333333333,
        "y": 6.39577179875911,
        "included": true,
        "missingReason": null
      },
      {
        "id": "row-20",
        "x": 0.6666666666666666,
        "y": 6.477945159554454,
        "included": true,
        "missingReason": null
      },
      {
        "id": "row-21",
        "x": 0.7,
        "y": 6.591035395184088,
        "included": true,
        "missingReason": null
      },
      {
        "id": "row-22",
        "x": 0.7333333333333333,
        "y": 6.685240911949104,
        "included": true,
        "missingReason": null
      },
      {
        "id": "row-23",
        "x": 0.7666666666666667,
        "y": 6.795200259333438,
        "included": true,
        "missingReason": null
      },
      {
        "id": "row-24",
        "x": 0.8,
        "y": 6.815662334963707,
        "included": true,
        "missingReason": null
      },
      {
        "id": "row-25",
        "x": 0.8333333333333334,
        "y": 6.9224520808740175,
        "included": true,
        "missingReason": null
      },
      {
        "id": "row-26",
        "x": 0.8666666666666667,
        "y": 6.975751884510116,
        "included": true,
        "missingReason": null
      },
      {
        "id": "row-27",
        "x": 0.9,
        "y": 7.000118383333728,
        "included": true,
        "missingReason": null
      },
      {
        "id": "row-28",
        "x": 0.9333333333333333,
        "y": 7.051304347434139,
        "included": true,
        "missingReason": null
      },
      {
        "id": "row-29",
        "x": 0.9666666666666667,
        "y": 7.095422210049965,
        "included": true,
        "missingReason": null
      },
      {
        "id": "row-30",
        "x": 1,
        "y": 7.122855360828646,
        "included": true,
        "missingReason": null
      },
      {
        "id": "row-31",
        "x": 1.0333333333333334,
        "y": 7.121116616664014,
        "included": true,
        "missingReason": null
      },
      {
        "id": "row-32",
        "x": 1.0666666666666667,
        "y": 7.058275355779679,
        "included": true,
        "missingReason": null
      },
      {
        "id": "row-33",
        "x": 1.1,
        "y": 7.0894940782800155,
        "included": true,
        "missingReason": null
      },
      {
        "id": "row-34",
        "x": 1.1333333333333333,
        "y": 7.026203663944002,
        "included": true,
        "missingReason": null
      },
      {
        "id": "row-35",
        "x": 1.1666666666666667,
        "y": 6.984775086042332,
        "included": true,
        "missingReason": null
      },
      {
        "id": "row-36",
        "x": 1.2,
        "y": 6.92214768161228,
        "included": true,
        "missingReason": null
      },
      {
        "id": "row-37",
        "x": 1.2333333333333334,
        "y": 6.870250930561328,
        "included": true,
        "missingReason": null
      },
      {
        "id": "row-38",
        "x": 1.2666666666666666,
        "y": 6.815099899748967,
        "included": true,
        "missingReason": null
      },
      {
        "id": "row-39",
        "x": 1.3,
        "y": 6.7087085193392735,
        "included": true,
        "missingReason": null
      },
      {
        "id": "row-40",
        "x": 1.3333333333333333,
        "y": 6.595856849308439,
        "included": true,
        "missingReason": null
      },
      {
        "id": "row-41",
        "x": 1.3666666666666667,
        "y": 6.506106896371478,
        "included": true,
        "missingReason": null
      },
      {
        "id": "row-42",
        "x": 1.4,
        "y": 6.417471045915452,
        "included": true,
        "missingReason": null
      },
      {
        "id": "row-43",
        "x": 1.4333333333333333,
        "y": 6.221594198161353,
        "included": true,
        "missingReason": null
      },
      {
        "id": "row-44",
        "x": 1.4666666666666666,
        "y": 6.120644315441678,
        "included": true,
        "missingReason": null
      },
      {
        "id": "row-45",
        "x": 1.5,
        "y": 5.978698195513364,
        "included": true,
        "missingReason": null
      },
      {
        "id": "row-46",
        "x": 1.5333333333333334,
        "y": 5.804015577087071,
        "included": true,
        "missingReason": null
      },
      {
        "id": "row-47",
        "x": 1.5666666666666667,
        "y": 5.641170287786991,
        "included": true,
        "missingReason": null
      },
      {
        "id": "row-48",
        "x": 1.6,
        "y": 5.456714447292244,
        "included": true,
        "missingReason": null
      },
      {
        "id": "row-49",
        "x": 1.6333333333333333,
        "y": 5.256587462981534,
        "included": true,
        "missingReason": null
      },
      {
        "id": "row-50",
        "x": 1.6666666666666667,
        "y": 5.0571643503577,
        "included": true,
        "missingReason": null
      },
      {
        "id": "row-51",
        "x": 1.7,
        "y": 4.818043948134716,
        "included": true,
        "missingReason": null
      },
      {
        "id": "row-52",
        "x": 1.7333333333333334,
        "y": 4.619470185546251,
        "included": true,
        "missingReason": null
      },
      {
        "id": "row-53",
        "x": 1.7666666666666666,
        "y": 4.33155406375544,
        "included": true,
        "missingReason": null
      },
      {
        "id": "row-54",
        "x": 1.8,
        "y": 4.105861912791016,
        "included": true,
        "missingReason": null
      },
      {
        "id": "row-55",
        "x": 1.8333333333333333,
        "y": 3.8509370716888265,
        "included": true,
        "missingReason": null
      },
      {
        "id": "row-56",
        "x": 1.8666666666666667,
        "y": 3.600302910628314,
        "included": true,
        "missingReason": null
      },
      {
        "id": "row-57",
        "x": 1.9,
        "y": 3.3091100147999035,
        "included": true,
        "missingReason": null
      },
      {
        "id": "row-58",
        "x": 1.9333333333333333,
        "y": 3.011894604928072,
        "included": true,
        "missingReason": null